{
  "$schema": "./cv.schema.json",
  "profile": {
    "name": "Ygor Goulart",
    "headline": {
      "title": {
        "en": "QA Tester",
        "pt-BR": "QA Tester"
      },
      "subtitle": {
        "en": "Test Automation",
        "pt-BR": "Automação de Testes"
      }
    },
    "location": {
      "city": "São Paulo",
      "country": {
        "en": "Brazil",
        "pt-BR": "Brasil"
      }
    },
    "about": {
      "en": "Senior QA Tester testing AAA games across PC, consoles and stores, with a background in IT support and ten years in design. I document and track defects in Jira and TestRail, and I am moving the repetitive work into automation with Playwright and TypeScript. This site is my test subject: every claim on it is backed by an automated check.",
      "pt-BR": "QA Tester Sênior testando jogos AAA em PC, consoles e lojas, com experiência em suporte de TI e dez anos em design. Documento e rastreio defeitos no Jira e no TestRail e estou levando o trabalho repetitivo para a automação com Playwright e TypeScript. Este site é meu objeto de teste: cada afirmação nele é sustentada por uma verificação automatizada."
    }
  },
  "contact": {
    "email": "ygorgm95@gmail.com",
    "linkedin": "https://www.linkedin.com/in/ygorgm/",
    "github": "https://github.com/ygg-m"
  },
  "experience": [
    {
      "id": "side",
      "visibility": "visible",
      "company": "SIDE",
      "role": {
        "en": "Senior QA Tester",
        "pt-BR": "QA Tester Sênior"
      },
      "start": "2025-12",
      "end": null,
      "image": "career/side.jpg",
      "highlights": [
        {
          "en": "Test multiple AAA titles across PC, Steam, PlayStation, Xbox, and Nintendo Switch 2.",
          "pt-BR": "Testar múltiplos títulos AAA em PC, Steam, PlayStation, Xbox e Nintendo Switch 2."
        },
        {
          "en": "Use Jira and TestRail to document, track, and manage defects through the full lifecycle.",
          "pt-BR": "Usar Jira e TestRail para documentar, rastrear e gerenciar defeitos durante todo o ciclo de vida."
        },
        {
          "en": "Execute exploratory, smoke, and regression tests to validate stability and functionality.",
          "pt-BR": "Executar testes exploratórios, de fumaça e de regressão para validar estabilidade e funcionalidade."
        },
        {
          "en": "Identify game-breaking bugs, reproduction steps, and platform-specific issues under certification standards.",
          "pt-BR": "Identificar bugs que quebram o jogo, passos de reprodução e problemas específicos de plataforma sob padrões de certificação."
        },
        {
          "en": "Collaborate with dev/QA teams to verify fixes and ensure a seamless player experience across hardware.",
          "pt-BR": "Colaborar com equipes de desenvolvimento/QA para verificar correções e garantir uma experiência do jogador fluida em diferentes hardwares."
        }
      ]
    },
    {
      "id": "acs-pro",
      "visibility": "visible",
      "company": "ACS Pro",
      "role": {
        "en": "Bilingual IT Support Analyst",
        "pt-BR": "Analista de Suporte de TI Bilíngue"
      },
      "start": "2025-01",
      "end": "2025-07",
      "image": "career/acs-pro.jpg",
      "highlights": [
        {
          "en": "Administer ManageEngine CRM tools, including configuration, custom workflows, and module customization.",
          "pt-BR": "Administrar ferramentas de CRM ManageEngine, incluindo configuração, fluxos de trabalho personalizados e personalização de módulos."
        },
        {
          "en": "Provide Tier 1/Tier 2 support, troubleshooting synchronization, data, API, and performance issues.",
          "pt-BR": "Prestar suporte Nível 1/Nível 2, solucionando problemas de sincronização, dados, API e desempenho."
        },
        {
          "en": "Manage users, roles, and access controls; perform database maintenance and system health checks.",
          "pt-BR": "Gerenciar usuários, funções e controles de acesso; realizar manutenção de banco de dados e verificações de integridade do sistema."
        },
        {
          "en": "Create technical documentation, user guides, and training to improve CRM adoption.",
          "pt-BR": "Criar documentação técnica, guias do usuário e treinamentos para melhorar a adoção do CRM."
        },
        {
          "en": "Translate business needs into CRM solutions and collaborate with teams to ensure system efficiency.",
          "pt-BR": "Traduzir necessidades de negócio em soluções de CRM e colaborar com equipes para garantir a eficiência do sistema."
        }
      ]
    },
    {
      "id": "concentrix",
      "visibility": "visible",
      "company": "Concentrix",
      "role": {
        "en": "Bilingual IT Support Analyst",
        "pt-BR": "Analista de Suporte de TI Bilíngue"
      },
      "start": "2023-02",
      "end": "2024-02",
      "image": "career/concentrix.jpg",
      "highlights": [
        {
          "en": "Tier 1/Tier 2 technical support for critical international banking systems and applications.",
          "pt-BR": "Suporte técnico N1/N2 para sistemas e aplicativos críticos de bancos internacionais."
        },
        {
          "en": "Used Jira and other tools to plan, track, and prioritize IT tasks efficiently.",
          "pt-BR": "Usei Jira e outras ferramentas para planejar, rastrear e priorizar tarefas de TI com eficiência."
        },
        {
          "en": "Monitored task progress, dependencies, and blockers to maintain operational efficiency.",
          "pt-BR": "Monitorei o andamento das tarefas, dependências e bloqueios para manter a eficiência operacional."
        }
      ]
    },
    {
      "id": "acsoftware",
      "visibility": "more",
      "company": "ACSoftware",
      "role": {
        "en": "BI Agent",
        "pt-BR": "Agente de BI"
      },
      "start": "2024-06",
      "end": "2025-01",
      "image": "career/acsoftware.jpg",
      "highlights": [
        {
          "en": "Transitioned from Customer Support to BI, using product and customer knowledge to drive data-informed decisions.",
          "pt-BR": "Transição de Suporte ao Cliente para BI, usando conhecimento de produto e cliente para apoiar decisões baseadas em dados."
        },
        {
          "en": "Analyzed and monitored KPIs for IT management software; built executive dashboards on usage, satisfaction, and market trends.",
          "pt-BR": "Analisei e monitorei KPIs de software de gestão de TI; construí dashboards executivos sobre uso, satisfação e tendências de mercado."
        },
        {
          "en": "Partnered with development on data collection strategies and supported sales with data-backed prospect insights.",
          "pt-BR": "Atuei com o desenvolvimento em estratégias de coleta de dados e apoiei vendas com insights de prospects baseados em dados."
        }
      ]
    },
    {
      "id": "pak",
      "visibility": "more",
      "company": "Planned Acts of Kindness",
      "role": {
        "en": "Web Developer",
        "pt-BR": "Desenvolvedor Web"
      },
      "start": "2022-11",
      "end": "2024-02",
      "image": "career/pak.jpeg",
      "highlights": [
        {
          "en": "Developed WordPress pages to expand the organization's global reach.",
          "pt-BR": "Desenvolvi páginas em WordPress para ampliar o alcance global da organização."
        },
        {
          "en": "Delivered accessible content that showcased the organization's initiatives and inspired engagement.",
          "pt-BR": "Entreguei conteúdo acessível que apresentou as iniciativas da organização e incentivou o engajamento."
        }
      ]
    },
    {
      "id": "ideamaker",
      "visibility": "more",
      "company": "Idea Maker",
      "role": {
        "en": "Lead Designer",
        "pt-BR": "Designer Líder"
      },
      "start": "2020-03",
      "end": "2022-10",
      "image": "career/ideamaker.jpg",
      "highlights": [
        {
          "en": "Consolidated a new company identity that improved external perception with clients.",
          "pt-BR": "Consolidei uma nova identidade da empresa que melhorou a percepção externa entre os clientes."
        },
        {
          "en": "Designed mobile applications reaching 10k+ weekly views and 2M+ downloads.",
          "pt-BR": "Projetei aplicativos móveis com mais de 10 mil visualizações semanais e mais de 2 milhões de downloads."
        },
        {
          "en": "Led a team of 4 responsible for all company media.",
          "pt-BR": "Liderei uma equipe de 4 pessoas responsável por toda a mídia da empresa."
        }
      ]
    },
    {
      "id": "liq",
      "visibility": "more",
      "company": "LIQ",
      "role": {
        "en": "Bilingual Tech Support",
        "pt-BR": "Suporte Técnico Bilíngue"
      },
      "start": "2017-03",
      "end": "2019-11",
      "image": "career/liq.png",
      "highlights": [
        {
          "en": "Provided bilingual technical support in English and Portuguese.",
          "pt-BR": "Prestei suporte técnico bilíngue em inglês e português."
        },
        {
          "en": "Resolved issues with operating systems, productivity apps, and hardware using incident management tools.",
          "pt-BR": "Resolvi problemas de sistemas operacionais, aplicativos de produtividade e hardware usando ferramentas de gestão de incidentes."
        },
        {
          "en": "Delivered user training and how-to documentation.",
          "pt-BR": "Entreguei treinamentos e documentação de instruções para os usuários."
        }
      ]
    },
    {
      "id": "freelance",
      "visibility": "more",
      "company": "Freelance",
      "role": {
        "en": "Designer & Developer",
        "pt-BR": "Designer e Desenvolvedor"
      },
      "start": "2010",
      "end": null,
      "image": "career/freelance.png",
      "highlights": [
        {